"Status","Start Time","Stop Time","Duration in ms","Parent Suite","Suite","Sub Suite","Test Class","Test Method","Name","Description"
"passed","Fri Oct 04 03:23:17 GMT 2024","Fri Oct 04 03:23:46 GMT 2024","28654","tests","test_gosuslugi29","","","","Тест поиска Подуслуг по Услуге","Этот тест собирает список подуслуг по услуге на сайте, проверяя доступность страницы услуги и наличия на странице услуги групп подуслуг и входящих в эти группы подуслуг"
"passed","Fri Oct 04 03:23:05 GMT 2024","Fri Oct 04 03:23:06 GMT 2024","1722","tests","test_gosuslugi29","","","","Тест Категорий","Этот тест собирает список категорий услуг на сайте, проверяя доступность страницы категорий и наличия на странице категорий объектов"
"passed","Fri Oct 04 03:23:06 GMT 2024","Fri Oct 04 03:23:17 GMT 2024","10986","tests","test_gosuslugi29","","","","Тест поиска Услуг по Категории","Этот тест собирает список услуг по категории на сайте, проверяя доступность страницы категории и наличия на странице категории услуг"
"broken","Fri Oct 04 03:26:47 GMT 2024","Fri Oct 04 03:26:47 GMT 2024","0","tests","test_gosuslugi29","","","","Тест проверки Параметров Подуслуги","Этот тест проверяет наличия на странице подуслуги проверяемых параметров"
"failed","Fri Oct 04 03:23:46 GMT 2024","Fri Oct 04 03:26:47 GMT 2024","180943","tests","test_gosuslugi29","","","","Тест поиска проверяемых Параметров по Подуслуге","Этот тест авторизуется на сайте, собирает список проверяемых параметров по подуслуге на сайте, проверяя доступность страницы подуслуги и наличия на странице подуслуги проверяемых параметров"
